[
  {
    "id": "education-earthquake-culture-memory",
    "audience_bg": "8-11 клас",
    "audience_en": "Grades 8-11",
    "duration_minutes": 55,
    "era_tags": [
      "modern"
    ],
    "subject_tags": [
      "history",
      "media_literacy",
      "cultural_policy"
    ],
    "title_bg": "Разрушение, възстановяване и културна столица",
    "title_en": "Destruction, Recovery and Cultural Capital",
    "summary_bg": "Урок за модерния Пловдив през визуални архиви: щетите от земетресението от 1928 г., културната програма от 1999 г. и Европейската столица на културата през 2019 г.",
    "summary_en": "A lesson on modern Plovdiv through visual archives: damage from the 1928 earthquake, the 1999 cultural programme and the 2019 European Capital of Culture.",
    "driving_question_bg": "Как градът превръща криза и културна програма в публична памет?",
    "driving_question_en": "How does a city turn crisis and cultural programming into public memory?",
    "objectives_bg": [
      "Учениците работят с историческа снимка като източник.",
      "Учениците разграничават архивен визуален факт от по-късно тълкуване.",
      "Учениците сравняват културните програми от 1999 и 2019 г. чрез публични източници."
    ],
    "objectives_en": [
      "Students work with a historical photograph as a source.",
      "Students distinguish an archival visual fact from later interpretation.",
      "Students compare the 1999 and 2019 cultural programmes through public sources."
    ],
    "preparation_bg": "Отворете архивните изображения за земетресението от 1928 г., записа за 1999 г. и събитието за 2019 г.",
    "preparation_en": "Open the 1928 earthquake archive images, the 1999 record and the 2019 event.",
    "lesson_steps": [
      {
        "minutes": 12,
        "phase_bg": "Визуално четене",
        "phase_en": "Visual reading",
        "activity_bg": "Учениците описват архивна снимка от земетресението само чрез видими детайли, преди да прочетат метаданните.",
        "activity_en": "Students describe an earthquake archive image only through visible details before reading metadata."
      },
      {
        "minutes": 13,
        "phase_bg": "Метаданни",
        "phase_en": "Metadata",
        "activity_bg": "Класът проверява дата, място, кредит, лиценз и източник на изображението.",
        "activity_en": "The class checks date, place, credit, license and source for the image."
      },
      {
        "minutes": 15,
        "phase_bg": "Културна програма",
        "phase_en": "Cultural programme",
        "activity_bg": "Групите сравняват твърденията за 1999 и 2019 г. и отбелязват кои числа идват от кой източник.",
        "activity_en": "Groups compare claims about 1999 and 2019 and mark which figures come from which source."
      },
      {
        "minutes": 15,
        "phase_bg": "Исторически текст",
        "phase_en": "Historical text",
        "activity_bg": "Учениците пишат кратък параграф за възстановяване и културна памет с поне две цитирани опори.",
        "activity_en": "Students write a short paragraph on recovery and cultural memory with at least two cited supports."
      }
    ],
    "quiz": [
      {
        "question_bg": "Какво първо се проверява при историческа снимка?",
        "question_en": "What should be checked first for a historical photograph?",
        "answers_bg": [
          "Дата, място, кредит и лиценз",
          "Само дали е драматична",
          "Само цветовете"
        ],
        "answers_en": [
          "Date, place, credit and license",
          "Only whether it is dramatic",
          "Only the colours"
        ],
        "correct_answer_index": 0,
        "explanation_bg": "Изображението трябва да има проследими метаданни, за да се използва като доказателство.",
        "explanation_en": "An image needs traceable metadata to be used as evidence."
      },
      {
        "question_bg": "Кое твърдение за 1999 г. трябва да се пази като контекст, а не като бюджетен ред?",
        "question_en": "Which 1999 claim should remain context, not a budget line?",
        "answers_bg": [
          "Мащабът на културната програма",
          "Официален годишен бюджет",
          "Данък върху имотите"
        ],
        "answers_en": [
          "The scale of the cultural programme",
          "An official annual budget",
          "Property tax"
        ],
        "correct_answer_index": 0,
        "explanation_bg": "Архивният запис за 1999 г. е програмен контекст, не общински бюджет.",
        "explanation_en": "The 1999 archive record is programme context, not a municipal budget."
      },
      {
        "question_bg": "Кой източник потвърждава европейския контекст на 2019 г.?",
        "question_en": "Which source confirms the European context of 2019?",
        "answers_bg": [
          "Европейската комисия",
          "Случаен форум",
          "Неподписан плакат"
        ],
        "answers_en": [
          "The European Commission",
          "A random forum",
          "An unsigned poster"
        ],
        "correct_answer_index": 0,
        "explanation_bg": "Записът за 2019 г. използва източник на Европейската комисия за титлата Европейска столица на културата.",
        "explanation_en": "The 2019 record uses a European Commission source for the European Capital of Culture title."
      }
    ],
    "printable_handout": {
      "title_bg": "Работен лист: снимка, програма, памет",
      "title_en": "Worksheet: image, programme, memory",
      "tasks_bg": [
        "Опишете архивна снимка без тълкуване.",
        "Добавете метаданни: дата, място, източник, лиценз.",
        "Сравнете едно твърдение за 1999 г. и едно за 2019 г."
      ],
      "tasks_en": [
        "Describe an archive image without interpretation.",
        "Add metadata: date, place, source, license.",
        "Compare one claim about 1999 and one about 2019."
      ]
    },
    "audio_tour": {
      "title_bg": "Маршрут за разходка: модерна памет",
      "title_en": "Walking route: modern memory",
      "production_status": "script_ready",
      "stops": [
        {
          "place_id": "place-ivan-vazov-national-library-q630839",
          "title_bg": "Народна библиотека Иван Вазов",
          "title_en": "Ivan Vazov National Library",
          "narration_bg": "Архивната снимка от 1928 г. напомня, че модерният град пази следи от бедствия и възстановяване.",
          "narration_en": "The 1928 archive image reminds us that the modern city preserves traces of disaster and recovery."
        },
        {
          "place_id": "place-ancient-theatre",
          "title_bg": "Античен театър",
          "title_en": "Ancient Theatre",
          "narration_bg": "През 1999 г. културната програма използва емблематични сцени. За историята е важно да различаваме мащаб на програма от бюджетни числа.",
          "narration_en": "In 1999 the cultural programme used emblematic venues. For history, it matters to distinguish programme scale from budget figures."
        },
        {
          "place_id": "place-plovdiv-city",
          "title_bg": "Пловдив 2019",
          "title_en": "Plovdiv 2019",
          "narration_bg": "Европейската столица на културата поставя града в европейска мрежа от културни политики и публична памет.",
          "narration_en": "The European Capital of Culture places the city in a European network of cultural policy and public memory."
        }
      ]
    },
    "linked_event_ids": [
      "event-event-1999-month-of-culture",
      "event-event-1999-month-of-culture-scale",
      "event-event-2019-european-capital-of-culture"
    ],
    "linked_place_ids": [
      "place-ivan-vazov-national-library-q630839",
      "place-ancient-theatre",
      "place-plovdiv-city"
    ],
    "linked_archive_item_ids": [
      "archive-photo-ivan-vazov-library-earthquake-1928",
      "archive-photo-chirpan-earthquake-st-josif-1928"
    ],
    "linked_then_now_pair_ids": [
      "then-now-ivan-vazov-library-earthquake-1928"
    ],
    "source_ids": [
      "source-wikimedia-commons-historical-images-plovdiv",
      "source-wikimedia-commons-bulgarian-archives-state-agency",
      "source-plovdiv-2019-official",
      "source-podtepeto-plovdiv-1999-month-culture-archive",
      "source-european-commission-ecoc-2019"
    ],
    "data_quality": "public_source",
    "editorial": {
      "status": "needs_editorial_signoff",
      "reviewed_by": null,
      "reviewed_at": null,
      "notes_bg": "Образователният ресурс е съставен от публични записи в базата и изисква педагогически и редакторски преглед преди официална употреба.",
      "notes_en": "The education resource is assembled from public knowledge-base records and requires pedagogical and editorial review before formal use."
    },
    "provenance": [
      {
        "source_id": "source-wikimedia-commons-historical-images-plovdiv",
        "evidence_type": "education_resource_source",
        "claim_bg": "Източници и образователни твърдения за урока \"Разрушение, възстановяване и културна столица\".",
        "claim_en": "Sources and educational claims for lesson \"Destruction, Recovery and Cultural Capital\".",
        "url": "https://commons.wikimedia.org/wiki/Category:Historical_images_of_Plovdiv",
        "accessed_at": "2026-06-19",
        "license_status": "open_license"
      },
      {
        "source_id": "source-wikimedia-commons-bulgarian-archives-state-agency",
        "evidence_type": "education_resource_source",
        "claim_bg": "Източници и образователни твърдения за урока \"Разрушение, възстановяване и културна столица\".",
        "claim_en": "Sources and educational claims for lesson \"Destruction, Recovery and Cultural Capital\".",
        "url": "https://commons.wikimedia.org/wiki/Commons:Bulgarian_Archives_State_Agency",
        "accessed_at": "2026-06-19",
        "license_status": "open_license"
      },
      {
        "source_id": "source-plovdiv-2019-official",
        "evidence_type": "education_resource_source",